{
  "documentId": "doc_oferta_aspersie",
  "documentType": "OFFER",
  "moduleId": "irigatii",
  "currency": "EUR",
  "supplierName": "Irigații Câmpia Demo SRL",
  "documentFields": [
    {
      "key": "SUPPLIER_NAME",
      "rawValue": "Irigații Câmpia Demo SRL",
      "unit": "TEXT",
      "page": 1,
      "confidence": "HIGH"
    },
    {
      "key": "DOCUMENT_NUMBER",
      "rawValue": "OF-2026-0412",
      "unit": "TEXT",
      "page": 1,
      "confidence": "HIGH"
    },
    {
      "key": "DOCUMENT_DATE",
      "rawValue": "12.10.2026",
      "unit": "DATE",
      "page": 1,
      "confidence": "HIGH"
    },
    {
      "key": "VALID_UNTIL",
      "rawValue": "60 de zile",
      "unit": "TEXT",
      "page": 1,
      "confidence": "HIGH"
    },
    {
      "key": "TOTAL_NET",
      "rawValue": "52.000,00 EUR",
      "unit": "EUR",
      "page": 1,
      "confidence": "HIGH"
    },
    {
      "key": "IRRIGATION_SYSTEM_TYPE",
      "rawValue": "aspersie cu tambur",
      "unit": "TEXT",
      "page": 1,
      "confidence": "HIGH"
    },
    {
      "key": "IRRIGATED_AREA_HA",
      "rawValue": "40 ha",
      "unit": "HA",
      "page": 1,
      "confidence": "HIGH"
    },
    {
      "key": "APPLICATION_EFFICIENCY_PCT",
      "rawValue": "75%",
      "unit": "PCT",
      "page": 1,
      "confidence": "HIGH"
    },
    {
      "key": "OPERATING_PRESSURE_BAR",
      "rawValue": "3,5 bar",
      "unit": "BAR",
      "page": 1,
      "confidence": "HIGH"
    }
  ],
  "lineItems": [
    {
      "lineId": "ln_1",
      "category": "IRRIGATION_SPRINKLER",
      "descriptionRo": "Hose-reel irrigation machine, 110 mm x 400 m hose",
      "fields": [
        {
          "key": "QUANTITY",
          "rawValue": "3 buc.",
          "unit": "PCS",
          "page": 1,
          "confidence": "HIGH"
        },
        {
          "key": "LINE_PRICE_NET",
          "rawValue": "33.000,00 EUR",
          "unit": "EUR",
          "page": 1,
          "confidence": "HIGH"
        }
      ]
    },
    {
      "lineId": "ln_2",
      "category": "PUMP",
      "descriptionRo": "Electric pump 55 kW, with control panel",
      "fields": [
        {
          "key": "PUMP_POWER_KW",
          "rawValue": "55 kW",
          "unit": "KW",
          "page": 1,
          "confidence": "HIGH"
        },
        {
          "key": "LINE_PRICE_NET",
          "rawValue": "11.500,00 EUR",
          "unit": "EUR",
          "page": 1,
          "confidence": "HIGH"
        }
      ]
    },
    {
      "lineId": "ln_3",
      "category": "PIPES",
      "descriptionRo": "HDPE supply pipe 160 mm and hydrants",
      "fields": [
        {
          "key": "LINE_PRICE_NET",
          "rawValue": "7.500,00 EUR",
          "unit": "EUR",
          "page": 1,
          "confidence": "HIGH"
        }
      ]
    }
  ],
  "missingFields": [
    {
      "key": "WATER_METER_INCLUDED",
      "reasonRo": "The offer does not mention a water meter. Metering is mandatory for the green loan."
    }
  ],
  "warnings": [
    "Offer valid for 60 days from 12 Oct 2026."
  ]
}