{
  "documentId": "doc_aviz_anar",
  "documentType": "WATER_PERMIT_ANAR",
  "moduleId": "irigatii",
  "currency": "UNKNOWN",
  "documentFields": [
    {
      "key": "PERMIT_NUMBER",
      "rawValue": "Autorizație de gospodărire a apelor AGA-DEMO-118/2025",
      "unit": "TEXT",
      "page": 1,
      "confidence": "HIGH"
    },
    {
      "key": "PERMIT_VALID_UNTIL",
      "rawValue": "03.03.2030",
      "unit": "DATE",
      "page": 1,
      "confidence": "HIGH"
    },
    {
      "key": "PERMITTED_VOLUME_M3",
      "rawValue": "280.000 m³/an",
      "unit": "M3",
      "page": 1,
      "confidence": "HIGH"
    },
    {
      "key": "WATER_SOURCE",
      "rawValue": "puț forat, adâncime 60 m, nivel dinamic 35 m",
      "unit": "TEXT",
      "page": 1,
      "confidence": "HIGH"
    }
  ],
  "lineItems": [],
  "missingFields": [],
  "warnings": []
}