{
  "documentId": "doc_oferta_fotovoltaice",
  "documentType": "OFFER",
  "moduleId": "energie",
  "currency": "EUR",
  "supplierName": "Solar Câmpia Demo SRL",
  "documentFields": [
    {
      "key": "DOCUMENT_NUMBER",
      "rawValue": "OF-PV-2026-077",
      "unit": "TEXT",
      "page": 1,
      "confidence": "HIGH"
    },
    {
      "key": "DOCUMENT_DATE",
      "rawValue": "08.10.2026",
      "unit": "DATE",
      "page": 1,
      "confidence": "HIGH"
    },
    {
      "key": "TOTAL_NET",
      "rawValue": "210.000 EUR",
      "unit": "EUR",
      "page": 1,
      "confidence": "HIGH"
    },
    {
      "key": "ENGINE_POWER_KW",
      "rawValue": "300 kWp",
      "unit": "KW",
      "page": 1,
      "confidence": "HIGH"
    }
  ],
  "lineItems": [
    {
      "lineId": "ln_1",
      "category": "PV_SYSTEM",
      "descriptionRo": "Panouri fotovoltaice monocristaline 550 Wp, certificate IEC 61215 / 61730",
      "fields": [
        {
          "key": "QUANTITY",
          "rawValue": "546 buc.",
          "unit": "PCS",
          "page": 1,
          "confidence": "HIGH"
        },
        {
          "key": "LINE_PRICE_NET",
          "rawValue": "98.000 EUR",
          "unit": "EUR",
          "page": 1,
          "confidence": "HIGH"
        }
      ]
    },
    {
      "lineId": "ln_2",
      "category": "PV_SYSTEM",
      "descriptionRo": "Invertoare trifazate 100 kW",
      "fields": [
        {
          "key": "QUANTITY",
          "rawValue": "3 buc.",
          "unit": "PCS",
          "page": 1,
          "confidence": "HIGH"
        },
        {
          "key": "LINE_PRICE_NET",
          "rawValue": "42.000 EUR",
          "unit": "EUR",
          "page": 1,
          "confidence": "HIGH"
        }
      ]
    },
    {
      "lineId": "ln_3",
      "category": "PV_SYSTEM",
      "descriptionRo": "Structură de montaj pe acoperiș, cabluri, protecții",
      "fields": [
        {
          "key": "LINE_PRICE_NET",
          "rawValue": "48.000 EUR",
          "unit": "EUR",
          "page": 1,
          "confidence": "HIGH"
        }
      ]
    },
    {
      "lineId": "ln_4",
      "category": "INSTALLATION_WORKS",
      "descriptionRo": "Proiectare, montaj, punere în funcțiune, dosar de racordare",
      "fields": [
        {
          "key": "LINE_PRICE_NET",
          "rawValue": "22.000 EUR",
          "unit": "EUR",
          "page": 1,
          "confidence": "HIGH"
        }
      ]
    }
  ],
  "missingFields": [],
  "warnings": []
}
