{
  "documentId": "doc_oferta_tractoare",
  "documentType": "OFFER",
  "moduleId": "utilaje",
  "currency": "EUR",
  "supplierName": "AgroTrac Distribuție SRL",
  "documentFields": [
    {
      "key": "SUPPLIER_NAME",
      "rawValue": "AgroTrac Distribuție SRL",
      "unit": "TEXT",
      "page": 1,
      "confidence": "HIGH"
    },
    {
      "key": "DOCUMENT_NUMBER",
      "rawValue": "OF-T-0921",
      "unit": "TEXT",
      "page": 1,
      "confidence": "HIGH"
    },
    {
      "key": "DOCUMENT_DATE",
      "rawValue": "09.10.2026",
      "unit": "DATE",
      "page": 1,
      "confidence": "HIGH"
    },
    {
      "key": "TOTAL_NET",
      "rawValue": "440.000,00 EUR",
      "unit": "EUR",
      "page": 2,
      "confidence": "HIGH"
    },
    {
      "key": "VAT_AMOUNT",
      "rawValue": "92.400,00 EUR",
      "unit": "EUR",
      "page": 2,
      "confidence": "HIGH"
    },
    {
      "key": "TOTAL_GROSS",
      "rawValue": "532.400,00 EUR",
      "unit": "EUR",
      "page": 2,
      "confidence": "HIGH"
    },
    {
      "key": "PRECISION_FEATURES",
      "rawValue": "pregătire ISOBUS; ghidaj RTK și section control: opțional, necomandate",
      "unit": "TEXT",
      "page": 3,
      "confidence": "MEDIUM"
    }
  ],
  "lineItems": [
    {
      "lineId": "ln_1",
      "category": "TRACTOR",
      "descriptionRo": "Tractor 240 CP, Stage V, nou, 2 buc.",
      "fields": [
        {
          "key": "QUANTITY",
          "rawValue": "2 buc.",
          "unit": "PCS",
          "page": 2,
          "confidence": "HIGH"
        },
        {
          "key": "ENGINE_POWER_HP",
          "rawValue": "240 CP",
          "unit": "HP",
          "page": 3,
          "confidence": "HIGH"
        },
        {
          "key": "EMISSION_STAGE",
          "rawValue": "Stage V",
          "unit": "TEXT",
          "page": 3,
          "confidence": "HIGH"
        },
        {
          "key": "CONDITION",
          "rawValue": "nou",
          "unit": "TEXT",
          "page": 2,
          "confidence": "HIGH"
        },
        {
          "key": "MANUFACTURE_YEAR",
          "rawValue": "2026",
          "unit": "YEAR",
          "page": 3,
          "confidence": "HIGH"
        },
        {
          "key": "SPECIFIC_FUEL_CONSUMPTION_G_KWH",
          "rawValue": "238 g/kWh",
          "unit": "G_KWH",
          "page": 3,
          "confidence": "MEDIUM"
        },
        {
          "key": "LINE_PRICE_NET",
          "rawValue": "250.000,00 EUR",
          "unit": "EUR",
          "page": 2,
          "confidence": "HIGH"
        }
      ]
    },
    {
      "lineId": "ln_2",
      "category": "TRACTOR",
      "descriptionRo": "Tractor 180 CP, Stage V, nou, 2 buc.",
      "fields": [
        {
          "key": "QUANTITY",
          "rawValue": "2 buc.",
          "unit": "PCS",
          "page": 2,
          "confidence": "HIGH"
        },
        {
          "key": "ENGINE_POWER_HP",
          "rawValue": "180 CP",
          "unit": "HP",
          "page": 4,
          "confidence": "HIGH"
        },
        {
          "key": "EMISSION_STAGE",
          "rawValue": "Stage V",
          "unit": "TEXT",
          "page": 4,
          "confidence": "HIGH"
        },
        {
          "key": "CONDITION",
          "rawValue": "nou",
          "unit": "TEXT",
          "page": 2,
          "confidence": "HIGH"
        },
        {
          "key": "MANUFACTURE_YEAR",
          "rawValue": "2026",
          "unit": "YEAR",
          "page": 4,
          "confidence": "HIGH"
        },
        {
          "key": "LINE_PRICE_NET",
          "rawValue": "190.000,00 EUR",
          "unit": "EUR",
          "page": 2,
          "confidence": "HIGH"
        }
      ]
    }
  ],
  "missingFields": [],
  "warnings": [
    "Oferta nu include ghidaj RTK, section control sau doză variabilă."
  ]
}